{
  "schema": "outcome-system-artifact/v1",
  "qualified_id": "group.C.C1",
  "objective_ref": {"path": "agent-workflows/fixtures/objective.json", "version": "v1", "digest": "sha256:aaaaaaaaaaaaaaaaaaaaaaaaaaaaaaaaaaaaaaaaaaaaaaaaaaaaaaaaaaaaaaaa"},
  "authority": {"namespace": "fixture:s2-foundation", "scope": "fixture-only", "owner_ref": {"kind": "fixture", "stable_id": "fixture-owner", "role": "outcome-owner", "path": "agent-workflows/tests/fixtures/s2/foundation/outcome/valid-outcome-artifact.json", "digest": "sha256:bbbbbbbbbbbbbbbbbbbbbbbbbbbbbbbbbbbbbbbbbbbbbbbbbbbbbbbbbbbbbbbb"}},
  "expected_head": {"revision": 14, "transaction_digest": "sha256:cccccccccccccccccccccccccccccccccccccccccccccccccccccccccccccccc"},
  "output": {"schema": "outcome-system-output/v1", "kind": "outcome_map", "payload": {"schema": "outcome-map/v1", "outcomes": [{"outcome_id": "observable-result", "achieved_state": "A user-observable result is present.", "why_required": "It contributes to the approved objective.", "objective_contribution": ["success-condition"], "exclusion_conditions": ["Implementation tasks are not outcomes."], "owner_ref": {"kind": "fixture", "stable_id": "fixture-owner", "role": "outcome-owner", "path": "agent-workflows/tests/fixtures/s2/foundation/outcome/valid-outcome-artifact.json", "digest": "sha256:bbbbbbbbbbbbbbbbbbbbbbbbbbbbbbbbbbbbbbbbbbbbbbbbbbbbbbbbbbbbbbbb"}, "acceptance_predicate_refs": [{"path": "agent-workflows/fixtures/predicate.json", "version": "v1", "digest": "sha256:dddddddddddddddddddddddddddddddddddddddddddddddddddddddddddddddd"}]}], "coverage_refs": [{"path": "agent-workflows/fixtures/coverage.json", "version": "v1", "digest": "sha256:eeeeeeeeeeeeeeeeeeeeeeeeeeeeeeeeeeeeeeeeeeeeeeeeeeeeeeeeeeeeeeee"}]}}
}
